{
  "$schema": "../../schemas/public-resume.schema.json",
  "schemaVersion": 1,
  "recordType": "resume",
  "id": "resume",
  "slug": "resume",
  "experienceStart": "2016-02-01",
  "summary": "Senior full-stack engineer building backend services, API integrations, and AI-powered tools across SaaS and financial products. Combines database and system design with frontend architecture, delivery automation, and technical leadership.",
  "highlights": [
    {
      "text": "Created Connect from its database queries and APIs to the reporting interface, serving more than 600 client companies.",
      "evidenceLevel": "self-reported"
    },
    {
      "text": "Delivered more than 50 reusable components adopted across more than 8 applications.",
      "evidenceLevel": "self-reported"
    },
    {
      "text": "Increased automated test coverage from 0% to 74% for a production commerce platform.",
      "evidenceLevel": "self-reported"
    },
    {
      "text": "Led hiring, mentoring, planning, and delivery for an engineering team of 8 developers.",
      "evidenceLevel": "self-reported"
    },
    {
      "text": "Developed automation that helped clients avoid approximately $300K in regulatory fines.",
      "evidenceLevel": "self-reported"
    }
  ],
  "skills": [
    "Node.js",
    "TypeScript",
    "API Design",
    "Backend Architecture",
    "PostgreSQL",
    "Python",
    "AI Integration",
    "System Design",
    "React",
    "Next.js",
    "Frontend Architecture",
    "Product Engineering",
    "Testing Strategy",
    "Developer Experience",
    "Technical Leadership",
    "Mentoring"
  ],
  "experiences": [
    {
      "id": "integritas-fintech-platform",
      "organization": "Integritas",
      "role": "Senior Full-Stack Engineer",
      "engagement": "full-time",
      "location": "Remote, USA",
      "domain": "Rogue Credit Union · Digital banking and rewards",
      "period": {
        "start": "2025-06-01",
        "end": null,
        "label": "June 2025-present"
      },
      "summary": "Leads API integration architecture, authentication, and full-stack delivery for Rogue Credit Union's digital banking and rewards application through Integritas, with focused contributions to infrastructure automation.",
      "contributions": [
        "Designed server-side API boundaries, authentication and validation patterns, and typed integrations with upstream services.",
        "Delivered full-stack features using React, TypeScript, Node.js, Zod, and OpenAPI-based backend contracts.",
        "Designed a mock API layer that allowed frontend and backend work to progress independently of upstream readiness.",
        "Expanded automated coverage with Vitest and Playwright for critical authenticated user flows.",
        "Contributed Ansible and Podman automation for preview routing, container lifecycle, and deployment health checks."
      ],
      "outcomes": [
        {
          "text": "Optimized the production-build workflow, reducing cold-build time by 60%.",
          "evidenceLevel": "measured"
        },
        {
          "text": "Enabled frontend and backend teams to work in parallel through a reusable mock API boundary.",
          "evidenceLevel": "self-reported"
        }
      ],
      "technologies": [
        "Node.js",
        "TypeScript",
        "Ansible",
        "Podman",
        "Nginx",
        "Linux",
        "Next.js",
        "React",
        "Tailwind CSS",
        "Azure",
        "OpenAPI",
        "Zod",
        "Vitest",
        "Playwright"
      ],
      "relatedProjects": [
        "financial-product-platform"
      ]
    },
    {
      "id": "alpha-omega-commerce",
      "organization": "Alpha Omega Agency",
      "role": "Senior Full-Stack Engineer",
      "engagement": "full-time",
      "location": "Remote, USA",
      "domain": "Headless commerce and content platforms",
      "period": {
        "start": "2023-10-01",
        "end": "2025-07-31",
        "label": "October 2023-July 2025"
      },
      "summary": "Led full-stack development for a high-traffic headless commerce platform spanning storefronts, content workflows, APIs, and third-party integrations.",
      "contributions": [
        "Led creation of the AOA Design System component library, building reusable primitives and composed components following atomic design principles.",
        "Delivered features across Next.js storefronts, content workflows, backend APIs, GraphQL integrations, and third-party services.",
        "Built content-managed storefront and marketing experiences for non-technical publishing teams.",
        "Established automated coverage for production workflows that previously had no test suite."
      ],
      "outcomes": [
        {
          "text": "Increased automated test coverage from 0% to 74%, improving regression visibility and release confidence.",
          "evidenceLevel": "self-reported"
        }
      ],
      "technologies": [
        "Next.js",
        "React",
        "TypeScript",
        "Node.js",
        "Express",
        "AWS Lambda",
        "Shopify",
        "GraphQL",
        "PostgreSQL",
        "Sanity",
        "MongoDB",
        "AWS"
      ],
      "relatedProjects": [
        "shared-frontend-platform"
      ]
    },
    {
      "id": "viamo-enterprise-ui",
      "organization": "Viamo",
      "role": "Senior Frontend Engineer",
      "engagement": "full-time",
      "location": "Remote, Canada",
      "domain": "Enterprise communication and social impact platforms",
      "period": {
        "start": "2021-10-01",
        "end": "2023-10-31",
        "label": "October 2021-October 2023"
      },
      "summary": "Built shared frontend foundations for a Vue-based enterprise platform connected to multiple applications and mentored engineers on scalable interface architecture.",
      "contributions": [
        "Designed and implemented a universal design system for a large Vue-based enterprise hub.",
        "Refactored and modernized legacy interfaces to improve consistency, maintainability, and developer experience.",
        "Mentored developers through component design, frontend standards, code reviews, and architecture decisions."
      ],
      "outcomes": [
        {
          "text": "Delivered more than 50 reusable components adopted across more than 8 applications within 2 months.",
          "evidenceLevel": "self-reported"
        }
      ],
      "technologies": [
        "TypeScript",
        "Vue",
        "Tailwind CSS",
        "Laravel",
        "Node.js",
        "Vite"
      ],
      "relatedProjects": []
    },
    {
      "id": "viasat-operations-analytics",
      "organization": "ViaSat",
      "role": "Senior Software Engineer",
      "engagement": "contract",
      "location": "Brazil",
      "domain": "Intelie · Real-time oil and gas analytics",
      "period": {
        "start": "2021-02-01",
        "end": "2021-09-30",
        "label": "February-September 2021"
      },
      "summary": "Built interactive dashboards for Intelie during my ViaSat engagement, translating real-time oil and gas operational datasets into React and Highcharts interfaces.",
      "contributions": [
        "Implemented interactive dashboards and data visualizations for real-time oil and gas operational analytics.",
        "Integrated complex datasets into performant React interfaces using Highcharts.",
        "Collaborated with backend engineers to validate data accuracy and improve analytics performance.",
        "Improved usability and performance for data-heavy internal operational analytics tools."
      ],
      "outcomes": [
        {
          "text": "Delivered production interfaces that made complex operational data usable through interactive analytics workflows.",
          "evidenceLevel": "self-reported"
        }
      ],
      "technologies": [
        "React",
        "TypeScript",
        "Redux",
        "PostgreSQL",
        "Highcharts"
      ],
      "relatedProjects": [
        "intelie"
      ]
    },
    {
      "id": "jca-accounting-platform",
      "organization": "JCA Contadores",
      "role": "Full-Stack Engineer / Team Lead",
      "engagement": "full-time",
      "location": "Brazil",
      "domain": "Connect · Accounting reports and financial statements",
      "period": {
        "start": "2016-02-01",
        "end": "2021-01-31",
        "label": "February 2016-January 2021"
      },
      "summary": "Created Connect from database queries and third-party integrations through APIs and reporting interfaces. Progressed to team lead, working directly with company directors on technical planning and delivery.",
      "contributions": [
        "Wrote complex database queries, integrated third-party systems, and built Connect's API endpoints and reporting interface.",
        "Worked directly with company directors to clarify requirements, plan tickets, and manage the engineering team and delivery board.",
        "Led hiring, mentoring, onboarding, code reviews, task planning, and delivery for a team of 8 developers.",
        "Built workflow automation for high-risk regulatory and accounting processes."
      ],
      "outcomes": [
        {
          "text": "Created Connect, used by more than 600 client companies for accounting charts, reports, and financial statements.",
          "evidenceLevel": "self-reported"
        },
        {
          "text": "Developed automation that helped clients avoid approximately $300K in regulatory fines.",
          "evidenceLevel": "self-reported"
        }
      ],
      "technologies": [
        "React",
        "Next.js",
        "TypeScript",
        "Node.js",
        "Laravel",
        "MySQL",
        "Vue",
        "Redis"
      ],
      "relatedProjects": [
        "connect"
      ]
    }
  ],
  "education": [
    {
      "id": "mba-software-engineering",
      "credential": "MBA in Software Engineering",
      "institution": "Universidade Estácio de Sá",